problem_id,problem_statement
1,"What were the top 3 drivers of the Q2 revenue decline, and how did the shift in category mix (e.g., Electronics vs. Fashion) impact our overall margin?"
2,"Which marketing channels are hitting diminishing returns, and where should we reallocate $50k of 'Social' budget to maximize ROAS?"
3,"Do returning customers acquired via 'Email' have a significantly higher lifetime value than those from 'Paid Search', and when is the critical churn window?"
4,"At which step of the checkout funnel is the drop-off highest for German (DE) users compared to Dutch (NL) users, and is it price-related?"
5,"Is the increased spend in Social driving true incremental revenue, or is it merely cannibalizing Organic traffic?"
6,"Which product categories show the highest revenue volatility across seasons, and can we stabilize this through regional expansion?"
